{
  "$schema": "../defaultSchema.json",
  "id": "Ind001",
  "sex": {
    "id": "NCIT:C16576",
    "label": "female"
  },
  "ethnicity": {
    "id": "NCIT:C43851",
    "label": "European"
  },
  "geographicOrigin": {
    "id": "GAZ:00002955",
    "label": "Slovenia"
  },
  "diseases": [
    {
      "diseaseId": {
        "id": "OMIM:164400",
        "label": "Spinocerebellar ataxia 1"
      },
      "ageOfOnset": {
        "ageGroup": {
          "id": "NCIT:C49685",
          "label": "Adult 18-65 Years Old"
        }
      },
      "familyHistory": false,
      "severityLevel": {
        "id": "HP:0012829",
        "label": "Profound"
      },
      "stage": {
        "id": "OGMS:0000119",
        "label": "acute onset"
      }
    }
  ]
}
